{
  "$id": "https://raw.githubusercontent.com/oracle/graalvm-reachability-metadata/master/metadata/schemas/metadata-library-index-schema-v2.0.1.json",
  "$schema": "https://json-schema.org/draft/2020-12/schema",
  "description": "Schema for metadata/<groupId>/<artifactId>/index.json. Each entry describes a metadata bundle for a range of library versions.",
  "type": "array",
  "minItems": 1,
  "items": {
    "type": "object",
    "additionalProperties": false,
    "required": [
      "allowed-packages",
      "metadata-version",
      "tested-versions"
    ],
    "properties": {
      "metadata-version": {
        "type": "string",
        "minLength": 1,
        "description": "Subdirectory name where the metadata files for this entry reside, e.g. '7.1.0.Final'."
      },
      "tested-versions": {
        "type": "array",
        "description": "Explicitly tested upstream library versions that this metadata is known to support.",
        "minItems": 1,
        "uniqueItems": true,
        "items": {
          "type": "string",
          "minLength": 1
        }
      },
      "test-version": {
        "type": "string",
        "minLength": 1,
        "description": "Overrides 'metadata-version' for use in test directories. This allows one metadata entry to share tests defined for a different version's metadata directory."
      },
      "source-code-url": {
        "type": "string",
        "minLength": 1,
        "description": "Optional URL pointing to the metadata source code for this entry."
      },
      "repository-url": {
        "type": "string",
        "minLength": 1,
        "description": "Optional URL pointing to the canonical project repository for this entry."
      },
      "documentation-url": {
        "type": "string",
        "minLength": 1,
        "description": "Optional URL pointing to the project documentation for this entry."
      },
      "description": {
        "type": "string",
        "minLength": 1,
        "description": "Optional two-sentence explanation of what the library does."
      },
      "language": {
        "$ref": "#/$defs/libraryLanguage"
      },
      "test-code-url": {
        "type": "string",
        "minLength": 1,
        "description": "Optional URL pointing to the test source code for this entry."
      },
      "latest": {
        "type": "boolean",
        "description": "Marks this entry as the latest/default metadata for currently supported versions."
      },
      "default-for": {
        "type": "string",
        "description": "Java regular expression describing the version range for which this entry should be used by default (e.g. '7\\\\.1\\\\..*')."
      },
      "override": {
        "type": "boolean",
        "description": "When true, expresses the intent to exclude outdated built-in metadata shipped with Native Image for the matched versions."
      },
      "allowed-packages": {
        "type": "array",
        "description": "Packages expected to contain metadata entries for this library. Used by CI checks.",
        "minItems": 1,
        "uniqueItems": true,
        "items": {
          "type": "string",
          "minLength": 1
        }
      },
      "skipped-versions": {
        "type": "array",
        "description": "Versions explicitly excluded from support, each with a reason.",
        "minItems": 1,
        "items": {
          "type": "object",
          "additionalProperties": false,
          "required": [ "version", "reason" ],
          "properties": {
            "version": {
              "type": "string",
              "minLength": 1
            },
            "reason": {
              "type": "string",
              "minLength": 1
            }
          }
        }
      },
      "requires": {
        "type": "array",
        "description": "List of dependent modules (group:artifact) whose metadata is required at runtime.",
        "minItems": 1,
        "uniqueItems": true,
        "items": {
          "$ref": "#/$defs/moduleCoordinate"
        }
      }
    }
  },
  "$defs": {
    "moduleCoordinate": {
      "type": "string",
      "pattern": "^[^:]+:[^:]+$"
    },
    "libraryLanguage": {
      "type": "object",
      "additionalProperties": false,
      "required": [ "name", "version" ],
      "properties": {
        "name": {
          "type": "string",
          "enum": [ "kotlin", "scala" ]
        },
        "version": {
          "type": "string",
          "minLength": 1
        }
      },
      "allOf": [
        {
          "if": {
            "properties": {
              "name": {
                "const": "scala"
              }
            },
            "required": [ "name" ]
          },
          "then": {
            "properties": {
              "version": {
                "enum": [ "2", "3" ]
              }
            }
          }
        },
        {
          "if": {
            "properties": {
              "name": {
                "const": "kotlin"
              }
            },
            "required": [ "name" ]
          },
          "then": {
            "properties": {
              "version": {
                "pattern": "^\\d+\\.\\d+(\\.\\d+)?$"
              }
            }
          }
        }
      ]
    }
  },
  "examples": [
    [
      {
        "metadata-version": "0.0.1",
        "tested-versions": [ "0.0.1", "0.0.2" ],
        "default-for": "0\\.0\\..*",
        "test-version": "0.0.1",
        "source-code-url": "https://github.com/example/project/tree/main/metadata/org.example/library/0.0.1",
        "repository-url": "https://github.com/example/project",
        "test-code-url": "https://github.com/example/project/tree/main/tests/src/org.example/library/0.0.1",
        "documentation-url": "https://github.com/example/project/tree/main/README.md",
        "description": "Example Library provides the core APIs for the example project. It focuses on simple integration points used by downstream applications.",
        "language": {
          "name": "kotlin",
          "version": "2.0"
        },
        "allowed-packages": [ "org.example.library" ]
      },
      {
        "latest": true,
        "metadata-version": "1.0.0",
        "tested-versions": [ "1.0.0", "1.1.0" , "1.2.0"],
        "allowed-packages": [ "org.example.library" ]
      },
      {
        "metadata-version": "1.19.0",
        "tested-versions": [ "1.19.0" ],
        "override": true,
        "allowed-packages": [ "io.opentelemetry" ],
        "skipped-versions": [
          { "version": "1.34.0", "reason": "Dependency io.opentelemetry:opentelemetry-api:1.34.0 provides reflect-config.json which does not parse." }
        ]
      }
    ]
  ]
}
