[
  {
    "latest": true,
    "allowed-packages": [ "com.zaxxer.hikari" ],
    "metadata-version": "2.4.13",
    "source-code-url": "https://repo1.maven.org/maven2/com/zaxxer/HikariCP-java7/2.4.13/HikariCP-java7-2.4.13-sources.jar",
    "repository-url": "https://github.com/brettwooldridge/HikariCP",
    "test-code-url": "https://github.com/brettwooldridge/HikariCP/tree/HikariCP-2.4.13/src/test",
    "documentation-url": "https://repo1.maven.org/maven2/com/zaxxer/HikariCP-java7/2.4.13/HikariCP-java7-2.4.13-javadoc.jar",
    "description": "HikariCP is a high-performance JDBC connection pool for Java applications. It manages database connections efficiently to reduce latency and resource overhead.",
    "tested-versions": [
      "2.4.13"
    ]
  }
]
