[
  {
    "latest" : true,
    "metadata-version" : "1.0",
    "source-code-url" : "https://repo1.maven.org/maven2/org/apache/portals/portlet-api_1.0_spec/1.0/portlet-api_1.0_spec-1.0-sources.jar",
    "repository-url" : "https://svn.apache.org/repos/asf/portals/portlet-spec",
    "test-code-url" : "N/A",
    "documentation-url" : "https://repo1.maven.org/maven2/org/apache/portals/portlet-api_1.0_spec/1.0/portlet-api_1.0_spec-1.0-javadoc.jar",
    "description" : "Portlet API 1.0 provides the Java interfaces and base classes defined by JSR 168 for building portal portlets. It defines the request, response, session, preferences, URL, mode, and lifecycle contracts that portal containers and portlet applications use to interact.",
    "tested-versions" : [
      "1.0"
    ],
    "allowed-packages" : [
      "javax.portlet"
    ]
  }
]
