[
  {
    "metadata-version" : "1.1.0",
    "source-code-url" : "https://repo1.maven.org/maven2/javax/cache/cache-api/1.1.0/cache-api-1.1.0-sources.jar",
    "repository-url" : "https://github.com/jsr107/jsr107spec",
    "test-code-url" : "N/A",
    "documentation-url" : "https://repo1.maven.org/maven2/javax/cache/cache-api/1.1.0/cache-api-1.1.0-javadoc.jar",
    "description" : "JSR107 (JCache) defines the standard Java API and SPI for interacting with caches. It lets applications use a common caching abstraction while enabling providers to implement compatible cache integrations.",
    "tested-versions" : [
      "1.1.0"
    ],
    "allowed-packages" : [
      "javax.cache"
    ]
  },
  {
    "latest" : true,
    "metadata-version" : "1.1.1",
    "source-code-url" : "https://repo1.maven.org/maven2/javax/cache/cache-api/1.1.1/cache-api-1.1.1-sources.jar",
    "repository-url" : "https://github.com/jsr107/jsr107spec",
    "test-code-url" : "N/A",
    "documentation-url" : "https://repo1.maven.org/maven2/javax/cache/cache-api/1.1.1/cache-api-1.1.1-javadoc.jar",
    "description" : "JSR107 (JCache) defines the standard Java API and SPI for interacting with caches. It lets applications use a common caching abstraction while enabling providers to implement compatible cache integrations.",
    "tested-versions" : [
      "1.1.1"
    ],
    "allowed-packages" : [
      "javax.cache"
    ]
  }
]
