[
  {
    "latest" : true,
    "metadata-version" : "6.0.0",
    "source-code-url" : "https://repo1.maven.org/maven2/org/osgi/osgi.cmpn/6.0.0/osgi.cmpn-6.0.0-sources.jar",
    "repository-url" : "https://github.com/osgi/osgi",
    "test-code-url" : "https://github.com/osgi/osgi/tree/r6-cmpn-ri-ct-final",
    "documentation-url" : "https://repo1.maven.org/maven2/org/osgi/osgi.cmpn/6.0.0/osgi.cmpn-6.0.0-javadoc.jar",
    "description" : "OSGi Compendium provides the Release 6 service, utility, and namespace APIs used to compile OSGi bundles. This artifact is a compile-time companion jar that packages interfaces and classes for the standardized compendium specifications.",
    "tested-versions" : [
      "6.0.0"
    ],
    "allowed-packages" : [
      "org.osgi"
    ]
  }
]
