[
  {
    "latest" : true,
    "metadata-version" : "3.1.5",
    "source-code-url" : "https://repo1.maven.org/maven2/io/reactivex/rxjava3/rxjava/3.1.5/rxjava-3.1.5-sources.jar",
    "repository-url" : "https://github.com/ReactiveX/RxJava",
    "test-code-url" : "https://github.com/ReactiveX/RxJava/tree/v3.1.5/src/test",
    "documentation-url" : "https://repo1.maven.org/maven2/io/reactivex/rxjava3/rxjava/3.1.5/rxjava-3.1.5-javadoc.jar",
    "description" : "RxJava is a Reactive Extensions implementation for the JVM that composes asynchronous and event-based programs using observable sequences. It provides reactive types such as Flowable, Observable, Single, Maybe, and Completable with operators, schedulers, backpressure handling, and test utilities for building reactive pipelines.",
    "tested-versions" : [
      "3.1.5"
    ],
    "allowed-packages" : [
      "io.reactivex.rxjava3"
    ]
  }
]
