[
  {
    "latest": true,
    "allowed-packages": [ "kotlin.script" ],
    "metadata-version": "2.3.20",
    "source-code-url": "https://repo.maven.apache.org/maven2/org/jetbrains/kotlin/kotlin-script-runtime/2.3.20/kotlin-script-runtime-2.3.20-sources.jar",
    "repository-url": "https://github.com/JetBrains/kotlin",
    "test-code-url": "https://github.com/JetBrains/kotlin/tree/v2.3.20/plugins/scripting/scripting-compiler/tests/org/jetbrains/kotlin/scripting/compiler/test",
    "documentation-url": "https://github.com/JetBrains/kotlin/releases/tag/v2.3.20",
    "description": "Provides the core Kotlin scripting runtime types, including standard script templates and dependency-resolution APIs used by Kotlin scripts. It supplies the classes that other Kotlin scripting components and hosts rely on to compile, configure, and run .kts scripts.",
    "tested-versions": [
      "2.3.20"
    ]
  }
]
