[
  {
    "latest": true,
    "allowed-packages": [ "org.apache.commons.text" ],
    "metadata-version": "1.9",
    "source-code-url": "https://repo.maven.apache.org/maven2/org/apache/commons/commons-text/1.9/commons-text-1.9-sources.jar",
    "repository-url": "https://gitbox.apache.org/repos/asf?p=commons-text.git",
    "test-code-url": "https://repo.maven.apache.org/maven2/org/apache/commons/commons-text/1.9/commons-text-1.9-test-sources.jar",
    "documentation-url": "https://repo.maven.apache.org/maven2/org/apache/commons/commons-text/1.9/commons-text-1.9-javadoc.jar",
    "description": "Apache Commons Text provides reusable utilities and algorithms for processing and manipulating strings. It includes features such as string escaping, variable substitution, similarity and distance calculations, and text translation.",
    "tested-versions": [
      "1.9"
    ]
  }
]
