[
  {
    "latest" : true,
    "metadata-version" : "4.3.1",
    "source-code-url" : "https://repo.maven.apache.org/maven2/org/osgi/org.osgi.core/4.3.1/org.osgi.core-4.3.1-sources.jar",
    "repository-url" : "https://github.com/osgi/osgi",
    "test-code-url" : "https://github.com/osgi/osgi/tree/r4v431-core-cmpn-spec-final/org.osgi.test.cases.framework",
    "documentation-url" : "https://repo.maven.apache.org/maven2/org/osgi/org.osgi.core/4.3.1/org.osgi.core-4.3.1-javadoc.jar",
    "description" : "This artifact provides the OSGi Core Release 4.3.1 API interfaces and classes used to compile OSGi bundles. It defines the framework contracts for bundles, module lifecycle, service registration, and runtime interaction in OSGi-based applications.",
    "tested-versions" : [
      "4.3.1"
    ],
    "allowed-packages" : [
      "org.osgi"
    ]
  },
  {
    "metadata-version" : "4.3.0",
    "source-code-url" : "https://repo.maven.apache.org/maven2/org/osgi/org.osgi.core/4.3.0/org.osgi.core-4.3.0-sources.jar",
    "repository-url" : "https://github.com/osgi/osgi",
    "test-code-url" : "https://github.com/osgi/osgi/tree/r4v43-core-ri-ct-final",
    "documentation-url" : "https://repo.maven.apache.org/maven2/org/osgi/org.osgi.core/4.3.0/org.osgi.core-4.3.0-javadoc.jar",
    "description" : "This artifact provides the core OSGi Service Platform Release 4.3 interfaces and classes. It defines the Framework APIs for bundles, lifecycle management, module wiring, and services used when compiling OSGi-based applications.",
    "tested-versions" : [
      "4.3.0"
    ],
    "allowed-packages" : [
      "org.osgi"
    ]
  }
]
