[
  {
    "latest" : true,
    "metadata-version" : "4.2.0",
    "source-code-url" : "https://repo.maven.apache.org/maven2/org/awaitility/awaitility/4.2.0/awaitility-4.2.0-sources.jar",
    "repository-url" : "https://github.com/awaitility/awaitility",
    "test-code-url" : "https://repo.maven.apache.org/maven2/org/awaitility/awaitility/4.2.0/awaitility-4.2.0-tests.jar",
    "documentation-url" : "https://repo.maven.apache.org/maven2/org/awaitility/awaitility/4.2.0/awaitility-4.2.0-javadoc.jar",
    "description" : "Awaitility is a Java DSL for waiting on asynchronous operations in tests without manual sleeps or polling loops. It lets assertions poll until conditions are satisfied or time out, making concurrent and eventually consistent behavior easier to verify.",
    "tested-versions" : [
      "4.2.0"
    ],
    "allowed-packages" : [
      "org.awaitility"
    ]
  }
]
