[
  {
    "latest" : true,
    "metadata-version" : "2.28.0",
    "source-code-url" : "https://repo.maven.apache.org/maven2/org/apache/activemq/artemis-log-annotation-processor/2.28.0/artemis-log-annotation-processor-2.28.0-sources.jar",
    "repository-url" : "https://github.com/apache/activemq-artemis",
    "test-code-url" : "https://github.com/apache/activemq-artemis/tree/2.28.0/artemis-log-annotation-processor/src/test",
    "documentation-url" : "https://repo.maven.apache.org/maven2/org/apache/activemq/artemis-log-annotation-processor/2.28.0/artemis-log-annotation-processor-2.28.0-javadoc.jar",
    "description" : "ActiveMQ Artemis Log Annotation Processor is a Java annotation processor for Artemis logging annotations such as LogBundle, Message, LogMessage, and GetLogger. It generates SLF4J-backed implementation classes at compile time and validates message identifiers and placeholders for annotated logging interfaces.",
    "tested-versions" : [
      "2.28.0",
      "2.29.0",
      "2.30.0",
      "2.31.0",
      "2.31.1",
      "2.31.2",
      "2.32.0",
      "2.33.0",
      "2.34.0",
      "2.35.0",
      "2.36.0",
      "2.37.0",
      "2.38.0"
    ],
    "allowed-packages" : [
      "org.apache.activemq.artemis.logs.annotation"
    ]
  }
]
