[
  {
    "latest" : true,
    "metadata-version" : "1.0",
    "source-code-url" : "https://repo1.maven.org/maven2/org/apache/geronimo/specs/geronimo-annotation_1.1_spec/1.0/geronimo-annotation_1.1_spec-1.0-sources.jar",
    "repository-url" : "https://svn.apache.org/repos/asf/geronimo/specs/",
    "test-code-url" : "N/A",
    "documentation-url" : "https://repo1.maven.org/maven2/org/apache/geronimo/specs/geronimo-annotation_1.1_spec/1.0/geronimo-annotation_1.1_spec-1.0-javadoc.jar",
    "description" : "This artifact provides Apache Geronimo's implementation of the JSR-250 Common Annotations 1.1 API in the javax.annotation packages. It supplies annotation types and annotation processing contracts used by Java EE components, dependency injection, security roles, lifecycle callbacks, generated code markers, and data source declarations.",
    "tested-versions" : [
      "1.0"
    ],
    "allowed-packages" : [
      "javax.annotation"
    ]
  }
]
