[
  {
    "latest" : true,
    "metadata-version" : "2.6.1.Final",
    "source-code-url" : "https://repo1.maven.org/maven2/org/cache2k/cache2k-core/2.6.1.Final/cache2k-core-2.6.1.Final-sources.jar",
    "repository-url" : "https://github.com/cache2k/cache2k",
    "test-code-url" : "https://github.com/cache2k/cache2k/tree/v2.6.1.Final/cache2k-core/src/test",
    "documentation-url" : "https://repo1.maven.org/maven2/org/cache2k/cache2k-core/2.6.1.Final/cache2k-core-2.6.1.Final-javadoc.jar",
    "description" : "cache2k-core provides the core implementation of cache2k, a lightweight high-performance caching library for Java applications. It implements cache storage, expiry, loading, and event behavior behind the stable cache2k API while keeping implementation classes internal to the release.",
    "tested-versions" : [
      "2.6.1.Final"
    ],
    "allowed-packages" : [
      "org.cache2k.core"
    ]
  }
]
