[
  {
    "latest": true,
    "allowed-packages": [ "com.fasterxml.jackson.dataformat.toml" ],
    "metadata-version": "2.15.2",
    "source-code-url": "https://repo1.maven.org/maven2/com/fasterxml/jackson/dataformat/jackson-dataformat-toml/2.15.2/jackson-dataformat-toml-2.15.2-sources.jar",
    "repository-url": "https://github.com/FasterXML/jackson-dataformats-text",
    "test-code-url": "https://github.com/FasterXML/jackson-dataformats-text/tree/jackson-dataformats-text-2.15.2/toml/src/test",
    "documentation-url": "https://repo1.maven.org/maven2/com/fasterxml/jackson/dataformat/jackson-dataformat-toml/2.15.2/jackson-dataformat-toml-2.15.2-javadoc.jar",
    "description": "Jackson Dataformat TOML adds Jackson support for reading and writing TOML documents. It provides TOML parsing and generation through Jackson's streaming and databinding APIs.",
    "tested-versions": [
      "2.15.2"
    ]
  }
]
