[
  {
    "latest" : true,
    "metadata-version" : "4.2.0",
    "source-code-url" : "https://repo.maven.apache.org/maven2/io/dropwizard/metrics/metrics-jmx/4.2.0/metrics-jmx-4.2.0-sources.jar",
    "repository-url" : "https://github.com/dropwizard/metrics",
    "test-code-url" : "https://github.com/dropwizard/metrics/tree/v4.2.0/metrics-jmx/src/test/java",
    "documentation-url" : "https://repo.maven.apache.org/maven2/io/dropwizard/metrics/metrics-jmx/4.2.0/metrics-jmx-4.2.0-javadoc.jar",
    "description" : "Dropwizard Metrics provides Java application instrumentation primitives such as gauges, counters, histograms, meters, and timers. The metrics-jmx module exposes those metrics through JMX MBeans so they can be inspected and monitored with standard JMX tools.",
    "tested-versions" : [
      "4.2.0"
    ],
    "allowed-packages" : [
      "com.codahale.metrics.jmx"
    ]
  }
]
