[
  {
    "latest" : true,
    "metadata-version" : "2.16.3",
    "source-code-url" : "https://repo1.maven.org/maven2/io/zipkin/reporter2/zipkin-reporter/2.16.3/zipkin-reporter-2.16.3-sources.jar",
    "repository-url" : "https://github.com/openzipkin/zipkin-reporter-java",
    "test-code-url" : "https://github.com/openzipkin/zipkin-reporter-java/tree/2.16.3/core/src/test/java",
    "documentation-url" : "https://repo1.maven.org/maven2/io/zipkin/reporter2/zipkin-reporter/2.16.3/zipkin-reporter-2.16.3-javadoc.jar",
    "description" : "Zipkin Reporter is the core Java library for asynchronously reporting Zipkin spans to pluggable senders. It provides buffering, batching, metrics hooks, and error handling used by transport-specific Zipkin reporter modules.",
    "tested-versions" : [
      "2.16.3",
      "2.16.4",
      "2.16.5",
      "2.17.0",
      "2.17.1",
      "2.17.2"
    ],
    "allowed-packages" : [
      "zipkin2.reporter"
    ]
  }
]
