[
  {
    "latest" : true,
    "metadata-version" : "1.0.2.v20150114",
    "source-code-url" : "https://repo1.maven.org/maven2/org/eclipse/aether/aether-util/1.0.2.v20150114/aether-util-1.0.2.v20150114-sources.jar",
    "repository-url" : "https://git.eclipse.org/c/aether/aether-core.git",
    "test-code-url" : "https://repo1.maven.org/maven2/org/eclipse/aether/aether/1.0.2.v20150114/aether-1.0.2.v20150114-source-release.zip",
    "documentation-url" : "https://repo1.maven.org/maven2/org/eclipse/aether/aether-util/1.0.2.v20150114/aether-util-1.0.2.v20150114-javadoc.jar",
    "description" : "Aether Util provides utility classes that make it easier to work with the Eclipse Aether repository system. It includes helpers for artifacts, dependency graph filtering and transformation, listeners, repository authentication, proxy selection, and version handling.",
    "tested-versions" : [
      "1.0.2.v20150114",
      "1.1.0"
    ],
    "allowed-packages" : [
      "org.eclipse.aether.util"
    ]
  }
]
