[
  {
    "latest" : true,
    "metadata-version" : "4.7.6",
    "source-code-url" : "https://repo1.maven.org/maven2/info/picocli/picocli/4.7.6/picocli-4.7.6-sources.jar",
    "repository-url" : "https://github.com/remkop/picocli",
    "test-code-url" : "https://repo1.maven.org/maven2/info/picocli/picocli/4.7.6/picocli-4.7.6-test-sources.jar",
    "documentation-url" : "https://repo1.maven.org/maven2/info/picocli/picocli/4.7.6/picocli-4.7.6-javadoc.jar",
    "description" : "Picocli is a Java command line parser for building command line applications with annotation-based and programmatic APIs. It generates usage help with ANSI colors, supports nested subcommands and autocomplete, and can be embedded as source or used as a dependency.",
    "tested-versions" : [
      "4.7.6",
      "4.7.7"
    ],
    "allowed-packages" : [
      "picocli"
    ]
  }
]
