[
  {
    "latest" : true,
    "metadata-version" : "1.0.0",
    "source-code-url" : "https://repo.maven.apache.org/maven2/org/osgi/org.osgi.namespace.service/1.0.0/org.osgi.namespace.service-1.0.0-sources.jar",
    "repository-url" : "https://github.com/osgi/osgi",
    "test-code-url" : "N/A",
    "documentation-url" : "https://repo.maven.apache.org/maven2/org/osgi/org.osgi.namespace.service/1.0.0/org.osgi.namespace.service-1.0.0-javadoc.jar",
    "description" : "This artifact defines the OSGi service namespace constants used to describe service capabilities and requirements in OSGi resource metadata. It provides the ServiceNamespace API for expressing service object class attributes and matching metadata rather than a runtime service implementation.",
    "tested-versions" : [
      "1.0.0"
    ],
    "allowed-packages" : [
      "org.osgi.namespace.service"
    ]
  }
]
