[
  {
    "latest" : true,
    "metadata-version" : "1.7",
    "source-code-url" : "https://repo1.maven.org/maven2/org/sonatype/aether/aether-api/1.7/aether-api-1.7-sources.jar",
    "repository-url" : "https://github.com/sonatype/sonatype-aether",
    "test-code-url" : "https://github.com/sonatype/sonatype-aether/tree/aether-1.7/aether-api/src/test/java",
    "documentation-url" : "https://repo1.maven.org/maven2/org/sonatype/aether/aether-api/1.7/aether-api-1.7-javadoc.jar",
    "description" : "Aether API defines the core interfaces for artifact resolution and repository access in a Maven-style dependency system. It provides contracts for dependency collection, version resolution, and local or remote repository interactions that implementations execute.",
    "tested-versions" : [
      "1.7"
    ],
    "allowed-packages" : [
      "org.sonatype.aether"
    ]
  }
]
