[
  {
    "latest" : true,
    "metadata-version" : "3.0.1u2",
    "source-code-url" : "https://repo1.maven.org/maven2/com/google/code/findbugs/annotations/3.0.1u2/annotations-3.0.1u2-sources.jar",
    "repository-url" : "https://github.com/findbugsproject/findbugs/",
    "test-code-url" : "N/A",
    "documentation-url" : "https://repo1.maven.org/maven2/com/google/code/findbugs/annotations/3.0.1u2/annotations-3.0.1u2-javadoc.jar",
    "description" : "FindBugs Annotations provides Java annotation types that let developers declare nullability, threading, and other static-analysis contracts in source code. These annotations are consumed by FindBugs-compatible tooling to detect likely defects without changing runtime behavior.",
    "tested-versions" : [
      "3.0.1u2"
    ],
    "allowed-packages" : [
      "edu.umd.cs.findbugs.annotations",
      "javax.annotation",
      "net.jcip.annotations"
    ]
  }
]
