[
  {
    "latest" : true,
    "metadata-version" : "1.1",
    "source-code-url" : "https://repo.maven.apache.org/maven2/javax/transaction/jta/1.1/jta-1.1-sources.jar",
    "repository-url" : "https://github.com/javaee/jta-spec",
    "test-code-url" : "N/A",
    "documentation-url" : "https://download.oracle.com/otndocs/jcp/jta-1.1-spec-oth-JSpec/",
    "description" : "This artifact provides the Java Transaction API 1.1 interfaces and exceptions in the javax.transaction and javax.transaction.xa packages. It defines the standard contracts used by Java transaction managers, application servers, resource managers, and applications to coordinate distributed transactions.",
    "tested-versions" : [
      "1.1"
    ],
    "allowed-packages" : [
      "javax.transaction"
    ]
  }
]
