[
  {
    "latest" : true,
    "metadata-version" : "1.0.0",
    "source-code-url" : "https://repo1.maven.org/maven2/org/osgi/org.osgi.resource/1.0.0/org.osgi.resource-1.0.0-sources.jar",
    "repository-url" : "https://github.com/osgi/osgi",
    "test-code-url" : "https://github.com/osgi/osgi/tree/r6-core-ri-ct-final/org.osgi.test.cases.framework/src/org/osgi/test/cases/framework/junit",
    "documentation-url" : "https://repo1.maven.org/maven2/org/osgi/org.osgi.resource/1.0.0/org.osgi.resource-1.0.0-javadoc.jar",
    "description" : "org.osgi.resource provides the OSGi Resource API, a set of interfaces for describing resources, their capabilities, requirements, wires, and wirings. It is used by OSGi frameworks and related services to model dependency resolution and the resolved wiring state of bundles or repository resources.",
    "tested-versions" : [
      "1.0.0",
      "1.0.1"
    ],
    "allowed-packages" : [
      "org.osgi.resource"
    ]
  }
]
