[
  {
    "latest" : true,
    "metadata-version" : "1.8",
    "source-code-url" : "https://repo1.maven.org/maven2/org/tukaani/xz/1.8/xz-1.8-sources.jar",
    "repository-url" : "https://github.com/tukaani-project/xz-java",
    "test-code-url" : "N/A",
    "documentation-url" : "https://repo1.maven.org/maven2/org/tukaani/xz/1.8/xz-1.8-javadoc.jar",
    "description" : "XZ for Java is a pure Java implementation of XZ data compression, including streaming compression and decompression for .xz data. It also supports random-access decompression and raw LZMA2 streams for applications that need lower-level compression primitives.",
    "tested-versions" : [
      "1.8"
    ],
    "allowed-packages" : [
      "org.tukaani.xz"
    ]
  }
]
